<?xml version="1.0" encoding="ISO-8859-1"?>
<!DOCTYPE gdd SYSTEM "gdd.dtd">
<gdd>
<package name="RichRecBase">

<!-- **************************************************************************
  * $Id: RichRecPixelOnRing.xml,v 1.2 2006-08-09 11:05:04 jonrob Exp $
  *****************************************************************************
  * XML-description of RichRecPixelOnRing class                               *
  * author: Chris Jones   Christopher.Rob.Jones@cern.ch                       *
  * date:   2006/08/03                                                        *
  ************************************************************************* -->


<class 
        name             = "RichRecPixelOnRing"
        virtual          = "FALSE"
        author           = "Chris Jones   (Christopher.Rob.Jones@cern.ch)" 
        desc             = "Ultility class to represent the association of a RichRecPixel to a RichRecRing" >

        <import name="Event/RichRecPixel"   soft="TRUE" />

 	<typedef 
		desc   = "typedef for std::vector of RichRecPixelOnRing" 
		access = "PUBLIC" 
		def    = "Vector" 
		type   = "std::vector&lt;RichRecPixelOnRing&gt;"
	/>

        <constructor 
                desc     = "Constructor from pixel and probability value" 
                initList = "m_pixel(pPix), m_associationProb(prob)">
                <arg const="FALSE" inout="BYVALUE" name="pPix" type="LHCb::RichRecPixel*"/>
                <arg const="TRUE"  inout="BYVALUE" name="prob" type="double"/>
                <code/>
        </constructor>
 
        <attribute 
                compression = "FALSE" 
                desc        = "RichRecPixel associated to the parent RichRecRing" 
                init        = "nullptr" 
                name        = "pixel" 
                type        = "LHCb::RichRecPixel*"
                nonconstaccessor = "TRUE"
        />

        <attribute 
                compression = "FALSE" 
                desc        = "The probability of the RichRecPixel association to the parent RichRecRing" 
                init        = "0" 
                name        = "associationProb" 
                type        = "double"
        />

</class>

</package>
</gdd>
