<?xml version="1.0" encoding="ISO-8859-1"?>
<!DOCTYPE gdd SYSTEM "gdd.dtd">
<gdd>
<package name="RichRecBase">

<!-- **************************************************************************
  * $Id: RichRecRingOnPixel.xml,v 1.2 2006-08-09 11:05:04 jonrob Exp $
  *****************************************************************************
  * XML-description of RichRecRingOnPixel class                               *
  * author: Chris Jones   Christopher.Rob.Jones@cern.ch                       *
  * date:   2006/08/03                                                        *
  ************************************************************************* -->


<class 
        name             = "RichRecRingOnPixel" 
        virtual          = "FALSE"
        author           = "Chris Jones   (Christopher.Rob.Jones@cern.ch)" 
        desc             = "Ultility class to represent the association of a RichRecRing to a RichRecPixel" >

        <import name="Event/RichRecRing" soft="TRUE" />

	<typedef 
		desc   = "typedef for std::vector of RichRecRingOnPixel" 
		access = "PUBLIC" 
		def    = "Vector" 
		type   = "std::vector&lt;RichRecRingOnPixel&gt;"
	/>
 
        <constructor 
                desc     = "Constructor from ring and probability value" 
                initList = "m_ring(pRing), m_associationProb(prob)">
                <arg const="FALSE" inout="BYVALUE" name="pRing" type="LHCb::RichRecRing*"/>
                <arg const="TRUE"  inout="BYVALUE" name="prob" type="double"/>
                <code/>
        </constructor>

        <attribute 
                compression = "FALSE" 
                desc        = "RichRecRing associated to the parent RichRecPixel" 
                init        = "nullptr" 
                name        = "ring" 
                type        = "LHCb::RichRecRing*"
                nonconstaccessor = "TRUE"
        />

        <attribute 
                compression = "FALSE" 
                desc        = "The probability of the RingRecRing association to the parent RichRecPixel" 
                init        = "0" 
                name        = "associationProb" 
                type        = "double"
        />

</class>

</package>
</gdd>
