<?xml version='1.0' encoding='UTF-8'?>
<!DOCTYPE gdd SYSTEM 'gdd.dtd'>
<gdd>
  <package name='TrackFitEvent'>

<!-- =============== VeloLiteMeasurement class definition =============== -->

    <class
      name        = 'VeloLiteMeasurement'
      author      = 'David Hutchcroft'
      desc        = 'Base class for a measurement made from a VeloLiteCluster.'
      serializers = 'FALSE'>

      <base name='LHCb::Measurement' />

      <import name='Event/Measurement' />
      <import name='Event/VeloCluster' />

      <constructor
        desc = 'Constructor'
               argList = ' LHCb::Measurement::Type&amp; type, LHCb::VeloLiteCluster cluster'
        initList = ' Measurement(type, LHCbID(cluster.channelID())), m_cluster(&amp;cluster)'> 
      </constructor>

      <attribute
        type = 'const LHCb::VeloLiteCluster*'
        name = 'cluster'
        desc = 'Pointer to the VeloLiteCluster'
	getMeth = 'FALSE'
        setMeth = 'FALSE'  />

      <method
        type  = 'const LHCb::VeloLiteCluster*'
        name  = 'cluster'
        desc  = 'Retrieve const  Pointer to the VeloLiteCluster'
        const = 'TRUE'>
        <code>
  return m_cluster;
        </code>
      </method>


      <method
	type    = 'LHCb::VeloChannelID'
	name    = 'channelID'
	desc    = 'channel identifier'
	const   = 'TRUE'>
	<code>
     return m_cluster->channelID() ;
        </code>
      </method>

      <method
	type    = 'bool'
	name    = 'highThreshold'
	desc    = 'has high Threshold'
	const   = 'TRUE'>
	<code>
      return m_cluster->highThreshold() ;
        </code>
      </method>
      
      <method
	type    = 'unsigned int'
	name    = 'size'
	desc    = 'cluster size'
	const   = 'TRUE'>
	<code>
     return m_cluster->pseudoSize();
        </code>
      </method>

    </class>

  </package>
</gdd>
