<?xml version="1.0" encoding="UTF-8"?>
<!DOCTYPE gdd SYSTEM "gdd.dtd" >
<gdd>
  <package name='GenEvent'>
<!-- ****************************************************************
     * GenHeader                                                    *
     ****************************************************************-->
     <class 
      author="Marco Cattaneo, revised by P. Koppenburg, then G.Corti"
      desc="Header for event generator information"
      name="GenHeader"
      location="Gen/Header"
      id="102"
     >
       &DataObject;
       <base name="ProcessHeader"/>
       <import name="Event/ProcessHeader"/>
      <import name="BeamParameters" soft="TRUE"/>
       <import name="GenCollision" soft="TRUE"/>
      <constructor
       desc="Constructor"
       initList = "m_luminosity(0.0), m_evType(0), m_evtNumber(0), m_totCrossSection(0.0), m_crossingFreq(0.0)" >
	<code>
	  setVersion( '2' );
	</code>
      </constructor>
       <attribute 
	desc="Retrieve const Instantaneous luminosity used for pileUp probability (for backward compatibility)"
        name="luminosity"
        type="double"
        init="0.0"
        setMeth="FALSE"
        getMeth="FALSE"
       />
       <attribute
        desc='LHCb event type. Code used in BookKeeping to identify samples, as defined in &lt;a href="http://cdsweb.cern.ch/record-restricted/855452/"&gt;LHCb-2005-034&lt;/a&gt;'
        name="evType"
        type="int"
        init="0"
       />
       <attribute
        desc="Event number"
        name="evtNumber"
        type="long long"
        init="0"
       />
       <attribute 
	desc="Retrieve const Total cross section used for pileUp probability (for backward compatibility)"
        name="totCrossSection"
        type="double"
        init="0.0"
        setMeth="FALSE"
        getMeth="FALSE"
       />
       <attribute 
	desc="Retrieve const Filled-filled bunches crossing frequency (for backward compatibility)"
        name="crossingFreq"
        type="double"
        init="0.0"
        setMeth="FALSE"
        getMeth="FALSE"
       />
       <relation
        desc="Pointer to collisions in this event"
        multiplicity="N"
        name="collisions"
        type="LHCb::GenCollision"
       />
      <relation
        desc="Pointer to beam parameters in this event"
        multiplicity="1"
        name="beamParameters"
        type="LHCb::BeamParameters"
        />
       <method
        const="TRUE"
        desc="Number of collisions in bunch crossing"
        name="numOfCollisions"
        type="unsigned int"
       >
	<code>
	  return collisions().size();
        </code>
       </method>
      <method
	const="TRUE"
	desc="Retrieve instantaneous luminosity used for pileup probability"
        name="luminosity"
        type="double"
      >
	<code>
         return ( '2' != version() ? m_luminosity : 
	  beamParameters() ? beamParameters()->luminosity() 
          : m_luminosity );
        </code>
      </method>
      <method
        const="TRUE"
        desc="Retrieve total cross-section used for pileup probability"
        name="totCrossSection"
        type="double"
      >
        <code>
         return ( '2' != version() ? m_totCrossSection : 
          beamParameters() ? beamParameters()->totalXSec() 
          : m_totCrossSection );
        </code>
      </method>
      <method
        const="TRUE"
        desc="Retrieve filled-filled bunches crossing frequency"
        name="crossingFreq"
        type="double"
      >
        <code>
         return ( '2' != version() ? m_crossingFreq : 
	  beamParameters() ? beamParameters()->revolutionFrequency() 
          : m_crossingFreq );
        </code>
      </method>
     </class>
  </package>
</gdd>
